{
  "specVersion": "1",
  "componentId": "thinking-indicator",
  "tier": "primitive",
  "requiredStoryKinds": ["default", "docs"],
  "ownedStoryRefs": [
    {
      "storyId": "contracts-pilot-recipe--thinking-indicator-recipe",
      "kinds": ["default"]
    },
    {
      "storyId": "contracts-generated-tokens--token-registry",
      "kinds": ["docs"]
    }
  ],
  "generatedArtifactRefs": {
    "tokenDocs": "storybook/stories/generated-token-docs.stories.tsx",
    "recipeDocs": "storybook/stories/pilot-recipe-contract.stories.tsx",
    "runtimeParity": "storybook/stories/runtime-css-parity.stories.tsx"
  },
  "downstreamHooks": {
    "codeEntrypoint": null,
    "figmaComponentRef": null,
    "supportedVariantsSource": "design-tokens/dist/tokens.ts",
    "slotNamesSource": "design-tokens/dist/tokens.ts",
    "exampleStoryIds": [
      "contracts-pilot-recipe--thinking-indicator-recipe",
      "contracts-generated-tokens--token-registry"
    ]
  }
}
