{
  "specVersion": "1",
  "componentId": "button",
  "tier": "primitive",
  "requiredStoryKinds": ["default", "docs"],
  "ownedStoryRefs": [
    {
      "storyId": "contracts-pilot-recipe--button-recipe",
      "kinds": ["default"]
    }
  ],
  "generatedArtifactRefs": {
    "tokenDocs": "storybook/stories/missing-generated-docs.stories.tsx",
    "recipeDocs": "storybook/stories/pilot-recipe-contract.stories.tsx",
    "runtimeParity": null
  },
  "downstreamHooks": {
    "codeEntrypoint": null,
    "figmaComponentRef": null,
    "supportedVariantsSource": "design-tokens/dist/tokens.ts",
    "slotNamesSource": "design-tokens/dist/tokens.ts",
    "exampleStoryIds": ["contracts-pilot-recipe--button-recipe"]
  }
}
