{
  "specVersion": "1",
  "componentId": "thinking-indicator",
  "tier": "primitive",
  "requiredStoryKinds": ["default", "variant-matrix", "state-matrix", "motion", "docs"],
  "ownedStoryRefs": [
    {
      "storyId": "ai-elements-thinking-indicator--default",
      "kinds": ["default"]
    },
    {
      "storyId": "ai-elements-thinking-indicator--variant-matrix",
      "kinds": ["variant-matrix"]
    },
    {
      "storyId": "ai-elements-thinking-indicator--state-matrix",
      "kinds": ["state-matrix"]
    },
    {
      "storyId": "ai-elements-thinking-indicator--motion",
      "kinds": ["motion"]
    },
    { "storyId": "ai-elements-thinking-indicator--docs", "kinds": ["docs"] }
  ],
  "generatedArtifactRefs": {
    "tokenDocs": "storybook/stories/missing-generated-docs.stories.tsx",
    "recipeDocs": "storybook/stories/pilot-recipe-contract.stories.tsx",
    "runtimeParity": null
  },
  "downstreamHooks": {
    "codeEntrypoint": null,
    "figmaComponentRef": null,
    "supportedVariantsSource": "design-tokens/dist/tokens.ts",
    "slotNamesSource": "design-tokens/dist/tokens.ts",
    "exampleStoryIds": [
      "ai-elements-thinking-indicator--default",
      "ai-elements-thinking-indicator--variant-matrix",
      "ai-elements-thinking-indicator--state-matrix",
      "ai-elements-thinking-indicator--motion",
      "ai-elements-thinking-indicator--docs"
    ]
  }
}
